{
  "version": "0.2.0",
  "planId": "env-001-plan",
  "sourceEnvelopeId": "env-001",
  "createdAt": "2026-01-15T09:30:00Z",
  "steps": [
    {
      "stepId": "step-1",
      "action": "Apply disinfectant to sink and counter surfaces"
    },
    {
      "stepId": "step-2",
      "action": "Scrub toilet bowl and wipe exterior surfaces"
    }
  ],
  "auditRequirements": {
    "logLevel": "standard",
    "retainDays": 90
  },
  "hash": "aead5a60451852c5d9d02b027cb173823243b200f80ad8dbdf4c23c465ea31de"
}
